"1329","Frölich 101","","Fragment ur Bagahavita - Oversigt fra höiden Gabaon","H. K. Höghet Prins Oscar, Julius Schram","1849","6","","Språk: svenska, norska","0","","1293840000","9999","30","","4"
"1330","Frölich 102","","Tal å Högtidsdagen i St. Erik - Frimureriets uppgift och betydelse - Tal i St. Johanneslogens, St. Christofer måltidsloge","O. E. Pauli, N. Sjöberg, B. Bergquist","0","1","","","0","","1293840000","9999","35","","3"
"1331","Frölich 103","","Underrättelser om St. Joh. medbrodersgraden - For vore Söstre","A. L. Nordström, Rob. Stricker","0","2","","Språk: svenska, danska","0","","1293840000","9999","28","","3"
"1332","Frölich 104","","Andreas Laerl.-Medbr.-Logens Indhold 2) Symbolet Y i Andr.-Laerl.-Medbr.-graden 3) Ved afslutningen af Arbeidet i Andr.-Logen Cubus Friderici Septimi","O. E. de Fontenay","0","4","","","0","","1293840000","9999","24","NO","3"
"1333","Frölich 105","","Österländska Bilder - Ved Logeaarets Slutning","N. Sjöberg, Sofus Raaen","0","1","","Språk: svenska, danska","0","","1293840000","9999","28","","3"
"1334","Frölich 106","","Högtidstal i Provinsiallogen i Linköping","G. R. Lundborg","0","6","","","0","","1293840000","9999","24","","4"
"1335","Frölich 107-108","","Ledtråd vid Frimurarens vandringar genom arbetsgraderna","Oscar Frölich","0","6","","","0","","1293840000","9999","0","","5"
"1336","Frölich 109","","En St. Johannesmästares åligganden - Ledningstal - Vandring i III:e grad","S. H. B. Svensson, A. L. Nordström, Rob. Stricker","0","3","","Språk: svenska, norska","0","","1293840000","9999","27","","5"
"1337","Frölich 011","","I. Bertraktelser öfver IV-V gradens innehåll II. Vid reception i IV-V graden","Oscar Frölich","0","4","","","0","","1293840000","9999","18","","4"
"1338","Frölich 110","","De 3 hårda slagen - To Vandringstale","O. Rogberg, Sofus Raaen","0","1","","Språk: svenska, danska","0","","1293840000","9999","22","","3"
"1339","Frölich 111","","Kirkebygningernes Symbolik","Carl Michelsen","0","6","","","0","","1293840000","9999","29","NO","4"
"1340","Frölich 112","","Utkast till instruktion i I:a St. Johannesgraden - Vandringstale holdt ved optagelsen af en Praest","C. Een, Sofus Raaen","0","1","","Språk: svenska, danska","0","","1293840000","9999","31","","3"
"1341","Frölich 113","","Om orörliga smycken - Om vänskap","Nils Sjöberg, J. Briant","0","1","","","0","","1293840000","9999","23","","3"
"1342","Frölich 114","","Reiserne I og II","O. E. de Fontenay","0","4","","","0","","1293840000","9999","24","NO","3"
"1343","Frölich 115","","Angreppen och förföljerserna mot Frimureriet","Nils Christoffer Dunér","0","1","","","0","","1293840000","9999","24","","3"
"1344","Frölich 116","","Symbolik - Förklaring af Igenkännings- och Lösenord","Hugo Sääf, C. L. Dahlfelt","0","6","","","0","","1293840000","9999","30","","4"
"1345","Frölich 117","","Tal hållna för ett lagilit Frimurare Samfund. - I. Om ädelt sinne. - II. Tal hållet 7:de St. Johannis Logen. - III. Ved L Arbeidernes Slutning","J. Briant, C. J. v. Eckleff, R. Stricker","0","1","","Språk: svenska, danska","0","","1293840000","9999","30","","3"
"1346","Frölich 118","","Adoniram och Frimureriets Mysterium","","0","3","","","0","","1293840000","9999","29","","4"
"1347","Frölich 119","","Symbolet Y Andr. Mestergraden 2) Regnbuen 3) Cirkeln","O. E. de Fontenay","0","6","","","0","","1293840000","9999","29","NO","4"
"1348","Frölich 012","","S:t Johannes Lärlingelogens öppnande och slutande","Oscar Frölich","0","1","","","0","","1293840000","9999","35","","2"
"1349","Frölich 120","","Johanneslaerlingens Arbeidsteppe","Anton Bergh","0","1","","","0","","1293840000","9999","31","","3"
"1350","Frölich 121","","Försök till tolkning af symboliken i den mörka gången","Hugo Hedberg","0","4","","","0","","1293840000","9999","37","","4"
"1351","Frölich 122-123","","Jämförelse mellan de gamla och de nya mysterierna","Oscar Frölich","0","3","","","0","","1293840000","9999","105","","4"
"1352","Frölich 124-125","","Kabbalan - bearbetning efter Possart","Oscar Frölich","0","6","","","0","","1293840000","9999","77","","4"
"1353","Frölich 013","","II:a Gradens Arbets-Tafla","Oscar Frölich","0","2","","","0","","1293840000","9999","25","","3"
"1354","Frölich 014","","Vandringarne","Oscar Frölich","0","4","","","0","","1293840000","9999","23","","4"
"1355","Frölich 015","","Antagningen till Fri-Murare","Oscar Frölich","0","1","","","0","","1293840000","9999","25","","3"
"1356","Frölich 016","","VI Gradens Historiska Uppgift","Oscar Frölich","0","6","","","0","","1293840000","9999","19","","2"
"1357","Frölich 017","","Om Formen inom Frimureriet och dess betydelse","Nils Christoffer Dunér","0","1","","","0","","1293840000","9999","19","","3"
"1358","Frölich 018","","VI Gradens Arb.tafla","Oscar Frölich","0","6","","","0","","1293840000","9999","32","","5"
"1359","Frölich 019","","Förklaringar öfver II gradens spörsmålsbok","Oscar Frölich","0","2","","","0","","1293840000","9999","21","","3"
"1360","Frölich 002","","Instruktioner för St. Johannis Medbröder","Oscar Frölich","1920","2","","","0","","1293840000","9999","13","","3"
"1361","Frölich 020","","Instruktion till Förklaring af St. Andr Mästare-Graden","Oscar Frölich","0","4","","","0","","1293840000","9999","22","","2"
"1362","Frölich 021","","Förklaring af Allegorier och Symboler i St. Johannes Mästare-Graden","Oscar Frölich","0","3","","","0","","1293840000","9999","19","","3"
"1363","Frölich 022","","Föredrag om De trenne St. Johannes Graderna, hållet uti St. Johannes Logens, St. Eric, Mästaregrad 1853 Februari 12 af OSCAR Ordförande Mästare","H. M. Konung Oscar I","1853","3","","","0","","1293840000","9999","31","","5"
"1364","Frölich 023","","Om Religionen inom Frimureriet enligt S:t Johannes lärlingegradens akter","Magnus Dalsjö","0","1","","","0","","1293840000","9999","39","","3"
"1365","Frölich 024","","De tre Johannesgradernas lösen","Emil Peterson","0","3","","Finnes även som Eos III:55.","0","","1293840000","9999","28","","3"
"1366","Frölich 025","","Ivignings-Tal af H. M. Konung OSCAR II - vid invigningen af Logen Kärnan i Helsingborg, den 8:e Septemb. 1884 - samt - Om Frimurarelärlingens dräkt och prydnader","H. M. Konung Oscar II, C. J. Ask","1884","1","","","0","","1293840000","9999","24","","4"
"1367","Frölich 026","","Är Frimureriet ett Mysterium? Huru har det blivit det?","Nils Christoffer Dunér","0","1","","","0","","1293840000","9999","35","","4"
"1368","Frölich 027","","H. M. Kong OSCAR II:s Tale ved det Norske Stamhuss Indvielse - samt - Fr. Murarens Arvode","H. M. Konung Oscar II, Joh. Lang","0","1","","","0","","1293840000","9999","21","NO","4"
"1369","Frölich 028","","En sökande Medbroders Mästare-vandring - J.L.U.D.-J.D.U.L. En St. Joh: Mästares Hösttankar","H. K. H. Prins Oscar, N. Flensburg","0","3","","","0","","1293840000","9999","22","","5"
"1370","Frölich 029","","Öfversigt öfver Sanct Johannes Lärlingegraden","S. H. B. Svensson","1894","1","","Föredrag hållet i den W.: St. Joh.: Logen St. Erik d. 7 Januari 1894.","0","","1293840000","9999","41","","4"
"1371","Frölich 003","","Försök till tolkning af Bilden i W uti St. Andr.-Logen","Oscar Frölich","0","4","","","0","","1293840000","9999","18","","4"
"1372","Frölich 030","","","","0","3","","Inbundet häfte av Dunér 30 felaktigt hänfört till Frölichs serie # var finns Frölich 30 har den inte kommit ut?","0","","1293840000","9999","0","","2"
"1373","Frölich 031","","Det historiska Elementet i St. Andr. Graderna","Oscar Frölich","0","4","","","0","","1293840000","9999","19","","6"
"1374","Frölich 032","","De fire evangelistsymboler","Julius Schram","0","6","","","0","","1293840000","9999","31","NO","4"
"1375","Frölich 033","","Tal i Skånska Provinsiallogen den 22 Mars 1895","Magnus Dalsjö","1895","6","","","0","","1293840000","9999","27","","5"
"1376","Frölich 034","","Instruktion till förklaring af St. Andr: Mästaregraden II","Oscar Frölich","0","6","","","0","","1293840000","9999","25","","8"
"1377","Frölich 035","","Instruktion till förklaring af St. Andr. Mästaregraden III - Antagnings-ceremonierna","Oscar Frölich","0","6","","","0","","1293840000","9999","30","","4"
"1378","Frölich 036","","Frimureriets betydelse för den enskilde medbroderns lif","A. O. Lindfors","0","2","","","0","","1293840000","9999","22","","3"
"1379","Frölich 037","","Förklaring af ceremonierna vid antagning till Frimurare","C. Een","0","1","","","0","","1293840000","9999","20","","4"
"1380","Frölich 038","","Adoniram","Nils Christoffer Dunér","0","4","","","0","","1293840000","9999","30","","4"
"1381","Frölich 039","","Tänk på döden!","Emil Peterson","0","3","","","0","","1293840000","9999","28","","4"
"1382","Frölich 004","","St. Johannis Logens uppgift och dess utveckling i St. Andraeas Logen","Oscar Frölich","0","4","","","0","","1293840000","9999","33","","4"
"1383","Frölich 040","","Om Tapes","Nils Sjöberg","0","1","","Föredraget i Landskrona Br.: Förening","0","","1293840000","9999","26","","4"
"1384","Frölich 041","","Om växtsymboliken i Frimureriet","Emil Peterson","0","6","","","0","","1293840000","9999","38","","4"
"1385","Frölich 042","","Till de nyantagne St. Andraeas-mästarne, I St. Andr. Logen Nordiska Cirkeln den 13 April 1896","S. H. B. Svensson","1896","6","","","0","","1293840000","9999","31","","4"
"1386","Frölich 043","","I. Tal - II. Föredrag - III. Ledningstal","H. M. Konung Oscar II, H. K. Höghet Kronprins Carl","1853","3","","","0","","1293840000","9999","27","","4"
"1387","Frölich 044","","Tal af H. K. Höghet Kronprins Carl - Föredrag angående uppkomsten, utvecklingen och tillämpningen af de fyra frimuraredygderna: Tyslåtenhet, Försigtighet, Måttlighet och Barmhärtighet","H. K. Höghet Kronprins Carl, L. A. Weser","1850","1","","","0","","1293840000","9999","30","","4"
"1388","Frölich 045","",""Föreskrifter för de förenade och rectifierade Frimurarelogerna; författade och antagne vid General Conventet i Wilhelmsbad år 1782 - Öfversättning."","","1782","1","","","0","0","1331161200","9999","28","SE","4"
"1389","Frölich 046","","Tal i Schefferska Logen - Tal i Nordiska Första - Tal i Nordiska Första","Odel, Hertigen av Södermanland, C. P. Freidenfelt","1903","1","","0","0","1293840000","9999","30","0","","4"
"1390","Frölich 047","","De symboliska tecknen X, Y och I","Emil Peterson","0","6","","0","0","1293840000","9999","0","0","","4"
"1391","Frölich 048","","Öfversikt öfver Sanct Johannes Medbroders graden","S. H. B. Svensson","1895","2","","0","0","1293840000","9999","43","0","","4"
"1392","Frölich 049","","Förberedande instruktion till Östra graden","S. H. B. Svensson","0","6","","0","0","1293840000","9999","0","0","","1"
"1393","Frölich 005","","St. Johannes Mästare-Graden","Oscar Frölich","0","3","","0","0","1293840000","9999","45","0","","2"
"1394","Frölich 050","","Föredrag af V.S.V. Konung OSCAR II: Några ord i S:t Johannes Medbroders-graden uttalade af Eques a Stella Duce 1897 - Sang og Dikt","H. M. Konung Oscar II, Sofus Raaen","1897","2","","0","0","1293840000","9999","24","0","","3"
"1395","Frölich 051","","Om det Förlorade som måste återfinnas","Nils Christoffer Dunér","0","6","","0","0","1293840000","9999","35","0","","4"
"1396","Frölich 052","","I:a Gradens Arbetstafla","Oscar Frölich","0","1","","0","0","0","1331161200","34","0","SE","3"
"1397","Frölich 053","","S:t Joh. Medbröders Arbetstafla","Nils Christoffer Dunér","0","2","","","0","0","1331161200","29","0","SE","3"
"1398","Frölich 054","","Frimureriets förhållande till de österländska religionerna och särskilt till Kabbalan","Oscar Frölich","0","6","","0","0","1293840000","9999","37","0","","4"
"1399","Frölich 055","","Hvor ligger St. Joh:. moderloge?","Julius Schram","0","1","","0","0","","1293840000","0","0","","4"
"1400","Frölich 056","","Gudsbegreppet - Rörliga Smycken","Nils Sjöberg","0","1","","0","0","","1293840000","0","0","","4"
"1401","Frölich 057","","Konung OSCAR II:s Femtioårs Frimurare Jubileum","","1898","1","","0","0","","1293840000","0","0","","5"
"1402","Frölich 058","","Tal 1782 - Lednings Tal, Arkeologisk Förklaring af Salomons Insegel, Några ord om St. Joh:. Mäst:. graden","C. F. von Eckleff, J. O. Wallin","0","3","","0","0","1293840000","9999","53","0","","4"
"1403","Frölich 059","","Treenigheten och dess Analogie","Carl Erik Sjögréen","1854","6","","0","0","1293840000","9999","37","0","","4"
"1404","Frölich 006","","St. Andraeas Mästare-Graden","Oscar Frölich","0","6","","0","0","1293840000","9999","22","0","","5"
"1405","Frölich 060","","Lednings-Tal vid Han Kongl. Höghet, Prins OSCAR FREDRIKS Reception i N.F. N:III 18 19/12 48 - Johannes-Mestergradens ethiske Betydning","O. Fryxell, Anton Bergh","0","3","","0","0","1293840000","9999","29","0","","4"
"1406","Frölich 061","","Vandringstale i 1ste Grad - Frimureriets äldre historia - Förteckning på hittills utgifne föredrag","Sofus Raaen, Oscar Frölich","0","1","","0","0","","1293840000","0","0","","6"
"1407","Frölich 062","","Vid Högtidsdagen i St: Jacob 1849 - St:Andreas gradens gyldene Tåg Byggnadskran och Arbetstafla","Anton Bergh","0","6","","","0","0","1331161200","33","0","SE","4"
"1408","Frölich 063","","I. Inledningsföredrag vid början av en ny arbetsperiod - II. Några ord om Frimureriets väsen","Nils Sjöberg, Oscar Frölich","0","1","","0","0","","1293840000","0","0","","3"
"1409","Frölich 064","",""Förvandlingen nalkas; Mina Bröder varen tillreds."","","0","3","","","0","0","1331161200","9999","43","SE","5"
"1410","Frölich 065-66","","Öfversigt öfver St. Andreas Lärl.-Medbr. grad","S. H. B. Svensson","0","4","","","0","","1293840000","9999","50","","4"
"1411","Frölich 067","","Den flammande stjärnan","K.W. Herdin","0","2","","","0","","1293840000","9999","31","","3"
"1412","Frölich 068","","Vandrings Tale 2) Er Frimureriet foraeldet og overflödigt? 3) Vandrings Tale 4) Vandrings Tal","Sofus Raaen, Oscar Frölich","0","1","","Språk: norska, svenska","0","","1293840000","9999","31","","3"
"1413","Frölich 069","","Den tillryggalagda banan - Ord och Lösen i St. Joh. och St. Andraeas graderna","H. K. H. Kronprins Carl, Anton Bergh","1853","6","","","0","","1293840000","9999","31","","4"
"1414","Frölich 007","","Hvad är en Fri-Murare ? - Huru skall han blifva det ?","Oscar Frölich","0","1","","","0","","1293840000","9999","18","","3"
"1415","Frölich 070","","Frimurare-Orden i förhållande till Kristendomen","Oscar Frölich","0","1","","","0","","1293840000","9999","26","","3"
"1416","Frölich 071","","Mörkter och Ljuset","Nils Christoffer Dunér","0","4","","","0","","1293840000","9999","28","","4"
"1417","Frölich 072","","I. Huruvda lättas och befordras sjelfkännedom i frimurares brödraskap? II. Lednings-Tal","A. L. Nordström","0","1","","","0","","1293840000","9999","27","","3"
"1418","Frölich 073-74","","Den Nordiska Första St. Johannes Logens Hundraårsfest","","1899","1","","","0","","1293840000","9999","55","","3"
"1419","Frölich 075","",""Om uppkomsten af dygdernas kvadratur; jämte några ord om Sunnan- och Nordanvindarne"","A. L. Nordström","0","4","","","0","0","1331161200","9999","26","SE","4"
"1420","Frölich 076","","Trilogier","Oscar Frölich","0","1","","","0","","1293840000","9999","32","","3"
"1421","Frölich 077","","Kristna Lärans Hemlighet","Carl Michelsen","0","6","","","0","","1293840000","9999","30","","4"
"1422","Frölich 078","","Brödra-kedjan","Nils Christoffer Dunér","0","2","","","0","","1293840000","9999","27","","3"
"1423","Frölich 079","","Öfversikt af St. Johannes Mästare Graden","S. H. B. Svensson","0","3","","","0","","1293840000","9999","30","","4"
"1424","Frölich 008","","Förklaringar öfver i I gradens spörsmålsbok förekommande frågor och svar","Oscar Frölich","0","1","","","0","0","1331074800","9999","22","SE","3"
"1425","Frölich 080","","Brödjakedjan och Föreningsbandet - Död och Odödlighet","M. Dalsjö","0","6","","","0","","1293840000","9999","23","","4"
"1426","Frölich 081","","Den mörka gången - Odödlighetsbegreppet","K. W. Herdin, Oscar Frölich","0","4","","","0","","1293840000","9999","23","","5"
"1427","Frölich 082","","Den frimureriske tredoppelte kaerlighed - Ved en Sösterfest i L Cimbria","Sofus Raaen, Rob. Stricker","0","1","","","0","","1293840000","9999","27","DK","3"
"1428","Frölich 083","","De 7 trin og söilen B - Tal uti 7:de S:t Joh:s Logens Medbroders Loge 1761","Julius Schram, C. Fr. v. Eckleff","1761","2","","Språk: svenska, danska","0","","1293840000","9999","22","","4"
"1429","Frölich 084","","Tåget, Stjärnan och Golfvet - Vandringstale i I:ste Grad","A. L. Nordström, Sofus Raaen","0","1","","Språk: svenska, danska","0","","1293840000","9999","23","","3"
"1430","Frölich 085","","Stöttepunkter - Vandringstale i III:e Grad","Viggo Holm, Sofus Raaen","0","3","","","0","","1293840000","9999","24","NO","4"
"1431","Frölich 086","","Den sökandes vandringar","K.W. Herdin","0","6","","","0","","1293840000","9999","30","","4"
"1432","Frölich 087-88","","Tydning och förklaring af förekommande allegoriska figurer, symboler och parabler - Hvorfra-Hvorfor-Hvorhen?","Ludv. Ahlberg, Sofus Raaen","0","3","","Språk: svenska, norska","0","","1293840000","9999","49","","4"
"1433","Frölich 089","","Vägen till Andraeaslogen - S:t Andreas-Lärlingens Vandringer i Norden og hans Skridt over Teppet - Hilsen til tvende til IV-V Grad befordrede Brödre","Anton Bergh, Sofus Raaen","0","4","","","0","","1293840000","9999","23","NO","3"
"1434","Frölich 009","","Sanct Johannis Lärlinge-Graden - Dess innehåll och betydelsen af dess ceremonier","Oscar Frölich","0","1","","","0","","1293840000","9999","26","","3"
"1435","Frölich 090","","Logens rörliga smycken - Tilfaeldigheds-Digde","Nils Christoffer Dunér, Sofus Raaen","0","1","","Språk: svenska, danska","0","","1293840000","9999","21","","3"
"1436","Frölich 091","","Unio Sacra - Eckleffs skotska grader","Carl Michelsen, Oscar Frölich","0","6","","","0","","1293840000","9999","30","","4"
"1437","Frölich 092","","Odödlighetstro och Evighetshopp - Adoniram i historiskt henseende","Nils Christoffer Dunér, Julius Schram","0","3","","Språk: svenska, norska","0","","1293840000","9999","38","","4"
"1438","Frölich 093","","H. K. Höghet, Prins Gustaf Adolfs antagning till frimurare - S:t Johannes Lärlingegradens Prof","Nils Christoffer Dunér, Oscar Frölich","1902","1","","Första skriften avser Prins Gustaf Adolfs sedermera konung Gustaf VI Adolfs inträde i Orden.","0","","1293840000","9999","31","","3"
"1439","Frölich 094","","Frimurarens arbete - Vandring i I Grad","Oscar Frölich, Rob. Stricker","0","1","","Språk: svenska, danska","0","","1293840000","9999","22","","3"
"1440","Frölich 095","","Högtidstal - Kronan","J. A. Westerlund, Oscar Frölich","1902","7","","22 resp. 20 sidor","0","","1293840000","9999","0","","3"
"1441","Frölich 096","","Föredrag vid årsfesten i L Cimbria - Föring i I:ste grad - Die letzte Loge","Sofus Raaen, Anton Bergh, von H. Grünig","0","1","","Språk: danska, tyska","0","","1293840000","9999","22","","3"
"1442","Frölich 097","","Om det nya och det gamla Mästareordet","K.W. Herdin","0","3","","","0","","1293840000","9999","23","","4"
"1443","Frölich 098","","Mesterens tale","Julius Schram","0","1","","","0","","1293840000","9999","29","DK","2"
"1444","Frölich 099","","Instruktion i St. Andraeas Lärling-Medbrodersgraden","Ludvig Ahlberg","0","4","","","0","","1293840000","9999","23","","3"
"1472","Tanker & Taler 24","","Den Gyldne Hovednögle","Niels Aarup","1994","6","","","0","","1293840000","9999","15","DK","1"
"1496","","","60 år som frimurare","Gunnar Edström","1979","0","","Ort: Lund","0","","1293840000","9999","187","","2"
"1513","","","Agenda B","Oswald Marbach","1861","2","","Ort: Leipzig.","0","","1293840000","9999","80","DE","2"
"1514","","","Agenda J","Oswald Marbach","1863","1","","Ort: Leipzig.","0","","1293840000","9999","359","DE","2"
"1515","","","Agenda MB","Oswald Marbach","1861","3","","Ort: Leipzig.","0","","1293840000","9999","159","DE","1"
"1517","","","Alkemiska skrifter","Johannes Franck","1992","0","","Ort: Stockholm","0","","1293840000","9999","107","","1"
"1531","","","Anteckningar till Svenska Frimureriets Historia berörande tiden från frimureriets införande i Sverige till... 1774, del I, samt från 1774 till och med år 1800, del II","Carl Ludvig Henning, Sv. S. L. L:s Öfverarkivarie Thulstrup","1892","0","","Ort: Stockholm","0","","1293840000","9999","0","","11"
"1539","","","Arbeiten am rohen Steine","Oswald Marbach","1862","0","","435 sid. Ort: Leipzig.","0","","1293840000","9999","435","DE","2"
"1550","","","Bakom lyckta dörrar","N. S. Norling","1940","0","","Ort: Stockholm","0","","1293840000","9999","227","","3"
"1552","","","Befrielsen - Stora boken om kristen tro","","1993","0","","","0","","1293840000","9999","383","","3"
"1582","","","Boken om de hieroglyfiska bilderna","Nicolas Flamel","1996","0","","Ort: Stockholm","0","","1293840000","9999","74","","1"
"1590","","","Brödraföreningen Concordia i Eksjö 1920-1970","E. Törnquist","1970","0","","Ort: Eksjö","0","","1293840000","9999","20","","2"
"1592","","","Brödraföreningen Gothungia 1954-1984","L. Ivarsson","1989","0","","Ort: Osby","0","","1293840000","9999","16","","8"
"1594","","","Brödraföreningen Kronan 125 år - 1873 - 1998","Arne Persson","1998","0","","Ort: Landskrona","0","","1293840000","9999","89","","3"
"1595","","","Brödraföreningen Kronan i Landskrona 100 år ett supplement om åren 1948 till 1973","Erik Blomgren","1973","0","","Ort: Landskrona","0","","1293840000","9999","40","","4"
"1597","","","Brödraföreningen Midnattssolen i Kiruna 1964-1974","H Hallstensson","0","0","","Ort: Kiruna","0","","1293840000","9999","32","","1"
"1598","","","Brödraföreningen Midnattssolen i Kiruna 1964-1979","H Hallstensson","0","0","","Ort: Kiruna","0","","1293840000","9999","18","","1"
"1603","","","Bååtska palatset - Svenska Frimurare Ordens stamhus","Ture Karlström, Tom C. Bergroth","1989","0","","28 sidor. Ort: Åbo","0","","1293840000","9999","28","","1"
"1654","","","Den Danske Store Landsloges Stamhus Kjöbenhavn","FR. J. Plum","0","0","","Ort: Köpenhamn.","0","","1293840000","9999","30","DK","1"
"1657","","","Den Gyllene Gripen 1810-1985 - 175 år","Curt Sjödell","1985","0","","Ort: Linköping","0","","1293840000","9999","56","","5"
"1661","","","Den Mellersta Pelaren - 200 år","Lars von Knorring, Gustaf Ruuth","1999","0","","81 sidor - gåva av Örjan Lindström - häftat. Ort: Jönköping","0","","1293840000","9999","81","","2"
"1662","","","Den nordiska första S:t Johanneslogen 1799-1999","Per-Olof Sandberg","2000","0","","CD-rom skiva med senaste 100 åren recipienter. Ort: Stockholm","0","","1293840000","9999","149","","2"
"1670","","","Den talande tystnaden","Carl Henrik Martling","1904","0","","Ort: Abedik","0","","1293840000","9999","112","","1"
"1674","","","Der Andreas-Lehrling-Gesellengrad","Otto Hieber","1976","4","","Leitfaden durch die Ordenslehre der GLFD. 40 sidor. Ort: Uetersen.","0","","1293840000","9999","40","DE","2"
"1683","","","Der Grad der Andreas-Lehrling-Gesellen in Vorträgen","Otto Hieber","1911","4","","Sammlung von Vorträgen über die Andreas-Grade - Erster Band. 351 sidor. Ort: Berlin.","0","","1293840000","9999","351","DE","1"
"1695","","","Der Johannis-Meistergrad","Otto Hieber","1976","3","","Leitfaden durch die Ordenslehre der GLFD. 56 sidor. Ort: Uetersen.","0","","1293840000","9999","56","DE","1"
"1725","","","Det okända palatset på Blasieholmen I - Historia, ägare, hyresmän","Bo Runmark","1989","0","","Ort: Borås","0","","1293840000","9999","255","","3"
"1737","","","Die drei ältesten Kunsturkunden der Freimaurerbrüderschaft, mitgeteilt, bearbeitet und in einem Lehrfragstücke urvergeistiget","Karl Christian Friedrich Krause","1819","0","","Ort: Dresden.","0","","1293840000","9999","0","DE","2"
"1743","","","Die Freimaurer (- Geschichte, Wesen, Wirken und Geheimnis der Königlichen Kunst)","Eugen Lennhoff","1929","0","","475 resp. 368 sidor (2 ex tryckta 1932 1 m acc år 1980) - 1 ex 1985. Ort: Leipzig.","0","","1293840000","9999","0","DE","1"
"1747","","","Die Freimaurerei in Deutschland","Oskar Henke","1906","0","","Bücherei für Freimaurer 1. Ort: Berlin.","0","","1293840000","9999","92","DE","2"
"1779","","","Die Religion der Freimaurer - Ein Weg zum deutschen Aufbau","Diedrich Bischoff","1922","0","","Ort: Stuttgart-Gotha.","0","","1293840000","9999","104","DE","1"
"1785","","","Die Tapis in ihrer historisch-paedagogischen, wissenschaftlichen und moralischen Bedeutung - oder: Geschichte der Urreligion als Basis der Freimaurerei","M. S. Polak","1855","0","","Ort: Amsterdam.","0","","1293840000","9999","463","DE","2"
"1811","","","En serie fördrag i grad I-III - I graden: Lärjungens verktyg, II graden: Medbrodergradens frimureriska verktyg, III graden: Att vara Johannes mästare.","Lennart Tuveson","1996","3","","4+4+5 sidor + 3 planscher - gåva av författaren","0","","1293840000","9999","0","","1"
"1828","","","EOS vägrödjaren - Ur den lundensiska frimurareföreningens hundraåriga historia","Sture Bergsten","1966","0","","Ort: Lund","0","","1293840000","9999","142","","3"
"1842","","","Ett samtal om frimureriet - Bearbetning efter tyska källor av S-N","","1906","0","","Ort: Stockholm","0","","1293840000","9999","16","","11"
"1848","","","Festskrift med anledning av S:t Johanneslogen Salomon à trois Serrures 150-åriga tillvaro","Carl Lagerberg","1904","0","","Ort: Göteborg","0","","1293840000","9999","479","","2"
